<?xml version="1.0" encoding="UTF-8"?>
<toop:TOOP_DataResponse xmlns:ccts="urn:un:unece:uncefact:documentation:2"
 xmlns:cct="urn:un:unece:uncefact:data:specification:CoreComponentTypeSchemaModule:2"
 xmlns:toop="http://toop.eu"
 xmlns:udt="urn:oasis:names:specification:ubl:schema:xsd:UnqualifiedDataTypes-2"
 xmlns:xsi="http://www.w3.org/2001/XMLSchema-instance"
 xsi:schemaLocation="http://toop.eu file:/C:/Users/yyi3320.ICNT/Desktop/TOOP_xsd_v0.5/xsd/toop/TOOP_DataExchange.xsd">
    <DocumentIdentifier schemeID="schemeID0" schemeName="schemeName0" schemeAgencyID="schemeAgencyID0" schemeAgencyName="schemeAgencyName0" schemeVersionID="schemeVersionID0" schemeDataURI="http://www.oxygenxml.com/" schemeURI="http://www.oxygenxml.com/">DocumentIdentifier0</DocumentIdentifier>
    <DocumentIssueDate>2006-05-04</DocumentIssueDate>
    <DocumentIssueTime>01:01:01.001</DocumentIssueTime>
    <DocumentUniversalUniqueIdentifier schemeID="schemeID1" schemeName="schemeName1" schemeAgencyID="schemeAgencyID1" schemeAgencyName="schemeAgencyName1" schemeVersionID="schemeVersionID1" schemeDataURI="http://www.oxygenxml.com/" schemeURI="http://www.oxygenxml.com/">DocumentUniversalUniqueIdentifier0</DocumentUniversalUniqueIdentifier>
    <DocumentVersionIdentifier schemeID="schemeID2" schemeName="schemeName2" schemeAgencyID="schemeAgencyID2" schemeAgencyName="schemeAgencyName2" schemeVersionID="schemeVersionID2" schemeDataURI="http://www.oxygenxml.com/" schemeURI="http://www.oxygenxml.com/">DocumentVersionIdentifier0</DocumentVersionIdentifier>
    <CopyIndicator>false</CopyIndicator>
    <DocumentTypeCode>data.request.registeredorganization</DocumentTypeCode>
    <SpecificationIdentifier schemeID="schemeID3" schemeName="schemeName3" schemeAgencyID="schemeAgencyID3" schemeAgencyName="schemeAgencyName3" schemeVersionID="schemeVersionID3" schemeDataURI="http://www.oxygenxml.com/" schemeURI="http://www.oxygenxml.com/">SpecificationIdentifier0</SpecificationIdentifier>
    <ProcessIdentifier schemeID="schemeID4" schemeName="schemeName4" schemeAgencyID="schemeAgencyID4" schemeAgencyName="schemeAgencyName4" schemeVersionID="schemeVersionID4" schemeDataURI="http://www.oxygenxml.com/" schemeURI="http://www.oxygenxml.com/">ProcessIdentifier0</ProcessIdentifier>
    <SessionIdentifier schemeID="schemeID5" schemeName="schemeName5" schemeAgencyID="schemeAgencyID5" schemeAgencyName="schemeAgencyName5" schemeVersionID="schemeVersionID5" schemeDataURI="http://www.oxygenxml.com/" schemeURI="http://www.oxygenxml.com/">SessionIdentifier0</SessionIdentifier>
    <DataConsumer>
        <DCUniqueIdentifier schemeID="schemeID6" schemeName="schemeName6" schemeAgencyID="schemeAgencyID6" schemeAgencyName="schemeAgencyName6" schemeVersionID="schemeVersionID6" schemeDataURI="http://www.oxygenxml.com/" schemeURI="http://www.oxygenxml.com/">DCUniqueIdentifier0</DCUniqueIdentifier>
        <DCName languageID="en-US" languageLocaleID="languageLocaleID0">DCName0</DCName>
        <DCElectronicAddressIdentifier schemeID="schemeID7" schemeName="schemeName7" schemeAgencyID="schemeAgencyID7" schemeAgencyName="schemeAgencyName7" schemeVersionID="schemeVersionID7" schemeDataURI="http://www.oxygenxml.com/" schemeURI="http://www.oxygenxml.com/">DCElectronicAddressIdentifier0</DCElectronicAddressIdentifier>
        <DCWebsite schemeID="schemeID8" schemeName="schemeName8" schemeAgencyID="schemeAgencyID8" schemeAgencyName="schemeAgencyName8" schemeVersionID="schemeVersionID8" schemeDataURI="http://www.oxygenxml.com/" schemeURI="http://www.oxygenxml.com/">DCWebsite0</DCWebsite>
        <DCLegalAddress>
            <AddressLine1 languageID="en-US" languageLocaleID="languageLocaleID1">AddressLine10</AddressLine1>
            <AddressLine2 languageID="en-US" languageLocaleID="languageLocaleID2">AddressLine20</AddressLine2>
            <AddressLine3 languageID="en-US" languageLocaleID="languageLocaleID3">AddressLine30</AddressLine3>
            <StreetName languageID="en-US" languageLocaleID="languageLocaleID4">StreetName0</StreetName>
            <StreetNumber languageID="en-US" languageLocaleID="languageLocaleID5">StreetNumber0</StreetNumber>
            <City languageID="en-US" languageLocaleID="languageLocaleID6">City0</City>
            <PostCode languageID="en-US" languageLocaleID="languageLocaleID7">PostCode0</PostCode>
            <Country languageID="en-US" languageLocaleID="languageLocaleID8">Country0</Country>
            <CountryCode listID="listID0" listAgencyID="listAgencyID0" listAgencyName="listAgencyName0" listName="listName0" listVersionID="listVersionID0" name="name0" languageID="en-US" listURI="http://www.oxygenxml.com/" listSchemeURI="http://www.oxygenxml.com/">AA</CountryCode>
        </DCLegalAddress>
    </DataConsumer>
    <DataSubject>
        <DataSubjectTypeCode listID="listID1" listAgencyID="listAgencyID1" listAgencyName="listAgencyName1" listName="listName1" listVersionID="listVersionID1" name="name1" languageID="en-US" listURI="http://www.oxygenxml.com/" listSchemeURI="http://www.oxygenxml.com/">DataSubjectTypeCode0</DataSubjectTypeCode>
        <LegalEntity>
            <LegalPersonUniqueIdentifier schemeID="schemeID9" schemeName="schemeName9" schemeAgencyID="schemeAgencyID9" schemeAgencyName="schemeAgencyName9" schemeVersionID="schemeVersionID9" schemeDataURI="http://www.oxygenxml.com/" schemeURI="http://www.oxygenxml.com/">LegalPersonUniqueIdentifier0</LegalPersonUniqueIdentifier>
            <LegalName languageID="en-US" languageLocaleID="languageLocaleID9">LegalName0</LegalName>
            <VATRegistrationNumber schemeID="schemeID10" schemeName="schemeName10" schemeAgencyID="schemeAgencyID10" schemeAgencyName="schemeAgencyName10" schemeVersionID="schemeVersionID10" schemeDataURI="http://www.oxygenxml.com/" schemeURI="http://www.oxygenxml.com/">VATRegistrationNumber0</VATRegistrationNumber>
            <TaxReferenceNumber schemeID="schemeID11" schemeName="schemeName11" schemeAgencyID="schemeAgencyID11" schemeAgencyName="schemeAgencyName11" schemeVersionID="schemeVersionID11" schemeDataURI="http://www.oxygenxml.com/" schemeURI="http://www.oxygenxml.com/">TaxReferenceNumber0</TaxReferenceNumber>
            <BusinessCode schemeID="schemeID12" schemeName="schemeName12" schemeAgencyID="schemeAgencyID12" schemeAgencyName="schemeAgencyName12" schemeVersionID="schemeVersionID12" schemeDataURI="http://www.oxygenxml.com/" schemeURI="http://www.oxygenxml.com/">BusinessCode0</BusinessCode>
            <LegalEntityIdentifier schemeID="schemeID13" schemeName="schemeName13" schemeAgencyID="schemeAgencyID13" schemeAgencyName="schemeAgencyName13" schemeVersionID="schemeVersionID13" schemeDataURI="http://www.oxygenxml.com/" schemeURI="http://www.oxygenxml.com/">LegalEntityIdentifier0</LegalEntityIdentifier>
            <EORIIdentifier schemeID="schemeID14" schemeName="schemeName14" schemeAgencyID="schemeAgencyID14" schemeAgencyName="schemeAgencyName14" schemeVersionID="schemeVersionID14" schemeDataURI="http://www.oxygenxml.com/" schemeURI="http://www.oxygenxml.com/">EORIIdentifier0</EORIIdentifier>
            <SEEDIdentifier schemeID="schemeID15" schemeName="schemeName15" schemeAgencyID="schemeAgencyID15" schemeAgencyName="schemeAgencyName15" schemeVersionID="schemeVersionID15" schemeDataURI="http://www.oxygenxml.com/" schemeURI="http://www.oxygenxml.com/">SEEDIdentifier0</SEEDIdentifier>
            <StandardIndustrialClassification listID="listID2" listAgencyID="listAgencyID2" listAgencyName="listAgencyName2" listName="listName2" listVersionID="listVersionID2" name="name2" languageID="en-US" listURI="http://www.oxygenxml.com/" listSchemeURI="http://www.oxygenxml.com/">0000</StandardIndustrialClassification>
            <AuthorisedRepresentativeIdentifier schemeID="schemeID16" schemeName="schemeName16" schemeAgencyID="schemeAgencyID16" schemeAgencyName="schemeAgencyName16" schemeVersionID="schemeVersionID16" schemeDataURI="http://www.oxygenxml.com/" schemeURI="http://www.oxygenxml.com/">AuthorisedRepresentativeIdentifier0</AuthorisedRepresentativeIdentifier>
            <LegalEntityLegalAddress>
                <AddressLine1 languageID="en-US" languageLocaleID="languageLocaleID10">AddressLine11</AddressLine1>
                <AddressLine2 languageID="en-US" languageLocaleID="languageLocaleID11">AddressLine21</AddressLine2>
                <AddressLine3 languageID="en-US" languageLocaleID="languageLocaleID12">AddressLine31</AddressLine3>
                <StreetName languageID="en-US" languageLocaleID="languageLocaleID13">StreetName1</StreetName>
                <StreetNumber languageID="en-US" languageLocaleID="languageLocaleID14">StreetNumber1</StreetNumber>
                <City languageID="en-US" languageLocaleID="languageLocaleID15">City1</City>
                <PostCode languageID="en-US" languageLocaleID="languageLocaleID16">PostCode1</PostCode>
                <Country languageID="en-US" languageLocaleID="languageLocaleID17">Country1</Country>
                <CountryCode listID="listID3" listAgencyID="listAgencyID3" listAgencyName="listAgencyName3" listName="listName3" listVersionID="listVersionID3" name="name3" languageID="en-US" listURI="http://www.oxygenxml.com/" listSchemeURI="http://www.oxygenxml.com/">AA</CountryCode>
            </LegalEntityLegalAddress>
        </LegalEntity>
        <NaturalPerson>
            <PersonIdentifier schemeID="schemeID17" schemeName="schemeName17" schemeAgencyID="schemeAgencyID17" schemeAgencyName="schemeAgencyName17" schemeVersionID="schemeVersionID17" schemeDataURI="http://www.oxygenxml.com/" schemeURI="http://www.oxygenxml.com/">PersonIdentifier0</PersonIdentifier>
            <FamilyName languageID="en-US" languageLocaleID="languageLocaleID18">FamilyName0</FamilyName>
            <FirstName languageID="en-US" languageLocaleID="languageLocaleID19">FirstName0</FirstName>
            <BirthDate>2006-05-04</BirthDate>